{
  "format": "basetool.blueprints",
  "formatVersion": "1.0",
  "generator": {
    "name": "SC Extractor",
    "version": "2.0.0"
  },
  "generatedAt": "2026-09-26T12:00:00Z",
  "items": [
    {
      "ref": {
        "name": "Oracle Helmet"
      },
      "acquiredAt": "2026-09-26T12:00:00Z",
      "provenance": {
        "source": "log",
        "observedAt": "2026-09-26T12:00:00Z"
      }
    }
  ]
}
